{
  "dataset_type": "ogyeiv2",
  "type_of_net": "EfficientNetV2MultiHeadAttention",
  "type_of_loss_func": "dmtl",
  "type_of_dmtl": "textual",
  "upper_norm_limit": 0.2,
  "margin": 0.5,
  "train_valid_ratio": 0.8,
  "epochs": 20,
  "batch_size": 128,
  "learning_rate": 0.0001,
  "weight_decay": 0.001,
  "step_size": 2,
  "gamma": 0.3333
}